product_id,product_name,category,brand,description,current_price,cost,stock_quantity,monthly_sales,average_rating,review_count,supplier,last_updated
PROD-083,Ashwagandha 1300mg Organic,Health & Wellness,StressRelief,"Organic ashwagandha root extract 1300mg. Supports stress relief and mood. Adaptogenic herb. Black pepper extract for absorption. Vegan capsules. 90-day supply.",26.99,12.25,423,156,4.6,1456,HealthDist Co,2024-03-11
PROD-084,Oven Mitts and Pot Holders 4-Piece,Kitchen & Dining,HeatShield,"Heat-resistant oven mitts and pot holders set, 4 pieces. Protects hands up to 500°F. Non-slip silicone grip. Machine washable. Hanging loops. Modern design in multiple colors.",19.99,7.75,512,178,4.5,423,HomeGoods Inc,2024-03-17
PROD-085,Battle Ropes 30 Feet,Sports & Fitness,CardioMax,"Heavy battle rope, 30 feet long and 1.5 inches thick. Durable poly dacron construction. Excellent for cardio and full-body conditioning. Includes anchor strap. Weight approximately 15 lbs.",69.99,32.50,98,34,4.7,234,FitGear Dist,2024-03-13
PROD-086,Monitor Stand with Storage,Electronics,DeskRise,"Monitor stand riser with storage drawer. Raises monitor to ergonomic height. Sturdy metal mesh construction. Drawer for office supplies. Supports up to 44 lbs. Dimensions: 16x9x5 inches.",29.99,12.75,389,145,4.6,678,OfficeSupply Co,2024-03-15
PROD-087,Elderberry Gummies Immune Support,Health & Wellness,ImmuneBoost,"Elderberry gummies for immune support. With vitamin C and zinc. Delicious berry flavor. Pectin-based, gelatin-free. Supports immune health year-round. 60-day supply.",21.99,10.25,478,189,4.5,989,HealthDist Co,2024-03-18
PROD-088,Wine Opener Corkscrew Set,Kitchen & Dining,VinoPro,"Wine opener set with corkscrew, foil cutter, and wine stopper. Ergonomic double-hinged design. Stainless steel construction. Includes wooden storage box. Perfect gift for wine lovers.",24.99,9.50,334,98,4.7,567,HomeGoods Inc,2024-03-12
PROD-089,Slam Ball 20 lbs,Sports & Fitness,IronFlex,"Slam ball 20 lbs with textured surface. Durable rubber shell doesn't bounce. Ideal for high-intensity workouts, CrossFit, and functional training. Available in multiple weights.",44.99,19.25,187,67,4.6,334,FitGear Dist,2024-03-16
PROD-090,Portable SSD 1TB External,Electronics,DataSpeed,"Portable SSD external hard drive 1TB. USB 3.1 Gen 2 for ultra-fast data transfer. Compact and durable aluminum design. Compatible with Windows, Mac, and gaming consoles. Includes USB-C cable.",119.99,62.50,156,54,4.7,892,TechSupply Co,2024-03-14
PROD-091,CoQ10 200mg Ubiquinol,Health & Wellness,HeartVital,"CoQ10 ubiquinol 200mg, the active form. Supports heart health and cellular energy. Enhanced absorption. Soy-free softgels. 60-day supply.",34.99,16.75,312,112,4.6,1123,HealthDist Co,2024-03-19
PROD-092,Mixing Spoon Wooden Set 6-Piece,Kitchen & Dining,EcoKitchen,"Wooden spoon set, 6 pieces in different sizes. Made from natural bamboo. Won't scratch non-stick cookware. Heat-resistant and durable. Hand wash recommended.",16.99,6.25,589,201,4.5,334,HomeGoods Inc,2024-03-11
PROD-093,Speed Rope Jump Rope,Sports & Fitness,CardioMax,"Speed jump rope with ball bearing handles. Adjustable cable length up to 10 feet. Aluminum handles. Ideal for double-unders and cardio workouts. Includes spare cable.",14.99,5.25,723,267,4.6,445,FitGear Dist,2024-03-17
PROD-094,Ring Light 10 inch with Stand,Electronics,StreamPro,"10-inch LED ring light with adjustable tripod stand (up to 62 inches). 3 color modes and 10 brightness levels. Phone holder included. Perfect for photography, makeup, streaming, and video calls.",39.99,17.50,289,119,4.5,1234,TechSupply Co,2024-03-13
PROD-095,Zinc 50mg Immune Health,Health & Wellness,ImmuneShield,"Zinc supplement 50mg for immune support. Supports immune function and skin health. Easy-to-swallow tablets. Non-GMO and gluten-free. 250-day supply.",12.99,5.75,612,234,4.5,892,HealthDist Co,2024-03-15
PROD-096,Citrus Juicer Manual,Kitchen & Dining,FreshPress,"Manual citrus juicer for lemons, limes, and oranges. Sturdy stainless steel construction. Non-slip base. Dishwasher safe. Extracts maximum juice with minimal effort. Easy to use and clean.",16.99,6.50,456,167,4.6,423,HomeGoods Inc,2024-03-18
PROD-097,Kettlebell 25 lbs,Sports & Fitness,IronFlex,"Cast iron kettlebell 25 lbs. Smooth finish with wide handle. Versatile for swings, squats, and Turkish get-ups. Durable construction. Color-coded by weight. Build strength and endurance.",49.99,23.75,198,76,4.7,567,FitGear Dist,2024-03-12
PROD-098,External Hard Drive 2TB USB 3.0,Electronics,DataVault,"External hard drive 2TB with USB 3.0. Fast data transfer speeds. Compact and portable design. Plug-and-play compatible with Windows and Mac. Includes USB cable and backup software.",79.99,39.50,223,87,4.5,1456,TechSupply Co,2024-03-16
PROD-099,B-Complex Vitamins High Potency,Health & Wellness,EnergyPlus,"B-complex vitamin supplement with all 8 B vitamins. Supports energy metabolism and nervous system. Vegan capsules. Non-GMO. 120-day supply.",18.99,8.50,534,189,4.6,1234,HealthDist Co,2024-03-14
PROD-100,Salad Spinner Large,Kitchen & Dining,FreshSpin,"Large salad spinner with 5-quart capacity. Easy pump mechanism. BPA-free plastic. Non-slip base. Locks for compact storage. Doubles as serving bowl. Dishwasher safe.",24.99,10.25,378,134,4.5,567,HomeGoods Inc,2024-03-19
PROD-101,Plyo Box 20x18x16 inches,Sports & Fitness,JumpMax,"Wooden plyo box for box jumps and step-ups. 3-in-1 design with heights 20, 18, and 16 inches. Sturdy construction supports up to 350 lbs. Non-slip surface. Great for CrossFit and functional training.",89.99,42.50,87,32,4.7,289,FitGear Dist,2024-03-11
PROD-102,Wireless Presenter Pointer,Electronics,PresentPro,"Wireless presenter with laser pointer. 2.4GHz connection up to 100 feet. Intuitive controls for PowerPoint. USB receiver stores in presenter. Includes carrying pouch. Perfect for teachers and professionals.",24.99,9.75,445,132,4.5,445,TechSupply Co,2024-03-17
PROD-103,Probiotics for Women 50 Billion CFU,Health & Wellness,FloraBalance,"Probiotics specifically formulated for women's health. 50 billion CFU with 16 strains. Supports digestive, immune, and vaginal health. Delayed-release capsules. 30-day supply.",29.99,14.25,389,145,4.7,1892,HealthDist Co,2024-03-13
PROD-104,Bread Box Bamboo,Kitchen & Dining,FreshKeep,"Bamboo bread box with roll-top lid. Keeps bread fresh longer. Natural ventilation prevents mold. Eco-friendly material. Compact design fits on countertop. Easy to clean.",34.99,14.75,267,89,4.5,334,HomeGoods Inc,2024-03-15
PROD-105,Foam Roller Vibrating,Sports & Fitness,RecoverPro,"Vibrating foam roller with 3 speed settings. High-intensity vibrations enhance muscle recovery. Rechargeable battery lasts up to 2 hours. Textured surface. Includes carry case. Great for post-workout recovery.",89.99,43.50,134,45,4.6,567,FitGear Dist,2024-03-18
